{
  "source": "https://www.youtube.com/watch?v=2x-WzWuS_oM",
  "artist": "Pandit Bhimsen Joshi",
  "notes": "Khyal in raga Yaman — vilambit and drut bandish followed by a tarana. Official audio distributed by Sony Music India (album Siddhi, Vol. 6).",
  "segments": [
    {
      "raga": "Yaman",
      "form": "KHYAL"
    }
  ]
}
